{
  "schema_version": 1,
  "contract": "code_assist.notion.internal_collaborative_backup_adr.v1",
  "adr_id": "O0A-P1-COORDINATED-BACKUP-ADR-001",
  "recorded_at": "2026-08-23T09:40:12Z",
  "status": "accepted_design_contract_current_runtime_unchanged",
  "packet_id": "O0A-P1",
  "authority_inputs": {
    "agents_md": {
      "path": "code_assist_v1/AGENTS.md",
      "sha256": "sha256:916383ca3674842d7dd2f9ef77af989b3b7dfe38e4c3f745072c6f9655d47549"
    },
    "planning_documents": [
      {
        "path": "code_assist_v1/docs/notion_parity/core_free_web_ui/INTERNAL_COLLABORATIVE_NOTION_ULTRA_EXECUTION_PLAN_V3.md",
        "sha256": "sha256:35de7238678c68ea889e271f3107c170fc233cefb667d455a34db42484e71377"
      },
      {
        "path": "code_assist_v1/docs/notion_parity/core_free_web_ui/INTERNAL_COLLABORATIVE_NOTION_XHIGH_IMPLEMENTATION_HANDOFF_V2.md",
        "sha256": "sha256:abaa2cc047e2b00e6e6d4abe1521743a3e0427eb1f6a2c64e4a7704254968912"
      }
    ],
    "sbe_instruction_manifest": [
      ["code_assist_v1/docs/knowledge_spaces/README.md", "sha256:090d886640ea2dc38e8d015a55530c17f4eaf9dd99c1ddf2ae57e5da358320ea"],
      ["code_assist_v1/docs/knowledge_spaces/second_brain_evolution/README.md", "sha256:56fd256f6aed116eed9e7c3d1b4d03f8cd83146ea376874be32c25740c7ed34b"],
      ["code_assist_v1/docs/knowledge_spaces/second_brain_evolution/PRODUCT_CONTRACT.md", "sha256:55fdc53dbf591d9974cf92d4042b6b4849d2e5a0c155bad4960f0a5acb33218c"],
      ["code_assist_v1/docs/knowledge_spaces/second_brain_evolution/FORWARD_SCHEMA.md", "sha256:861a95d471d9bef0e2f386571cc4f723cc33af626c2f85812c990a96bf928604"],
      ["code_assist_v1/docs/knowledge_spaces/second_brain_evolution/EXECUTION_PLAN.md", "sha256:5883c6955430e04b4149cd69c0b96839fc4a5c7281748b001c4214197e46d15e"],
      ["code_assist_v1/docs/knowledge_spaces/second_brain_evolution/ACCEPTANCE.md", "sha256:bfd769be8757740f80e534fda6a9d50e7ae0652830e82b7b4e8472f809cb36bb"],
      ["code_assist_v1/docs/knowledge_spaces/DECISIONS.md", "sha256:f764bec2b35730fc0b012415400059e61787d38f43b78914d46af9bca94ca7db"],
      ["code_assist_v1/docs/knowledge_spaces/ARCHITECTURE.md", "sha256:bb8552653b0f02128302d7bf1cb7d75f65000215f01e138398be8b81c62520aa"],
      ["code_assist_v1/docs/knowledge_spaces/SCHEMA_V1.md", "sha256:15de58b4ba6f7dd4c9f77087bed795ba3ab07cb9fbdada36a92e6d7164c91e21"],
      ["code_assist_v1/docs/knowledge_spaces/API_UI_CONTRACT.md", "sha256:731d920ccf1e72926ca3d5cfbb34e0ff2720bb57a73353ef89c50c32528d9411"],
      ["code_assist_v1/docs/knowledge_spaces/CURRENT_SYSTEM_INVENTORY.md", "sha256:bdf39d05337d918917e34b9d68187bfeb4799920d871b1688ece9d488735c55d"],
      ["code_assist_v1/docs/knowledge_spaces/MIGRATION_ROLLOUT.md", "sha256:0008ded180852070f2d9d3a555052695b704651dd72a98c54979c10311354f0f"],
      ["code_assist_v1/docs/knowledge_spaces/TEST_OPERATIONS.md", "sha256:fa429c36bc5034818fbcd18a79fa66e36a8af863837afb263b4d1258a20fbc5b"],
      ["code_assist_v1/docs/knowledge_spaces/DEVELOPMENT_BASELINE.md", "sha256:608792faa9998740b5009aa721260b56ad15a6affab7420abbe0b0ecab8a9edc"],
      ["code_assist_v1/docs/knowledge_spaces/IMPLEMENTATION_BACKLOG.md", "sha256:6c11b28e21f7f38b12e99243cc675e8716b3d32e68fe83d3db0529164b04fd5e"],
      ["code_assist_v1/docs/knowledge_spaces/TRACEABILITY.md", "sha256:995fb1ecbe83a1e320e6ae2858a69b51c66fa53bbc6c0a9f72414d704ab73735"],
      ["code_assist_v1/docs/knowledge_spaces/GOAL_CONTRACT.json", "sha256:46ce12ad70e424dc1c381d496dfb71cc9f7955606fe9945a72bff1ccf2d2d71b"],
      ["code_assist_v1/docs/knowledge_spaces/STATUS.md", "sha256:8159896bafae8bba05c0bfca6f4d7eb530570dabaa7fa2c984cf402c95346f49"]
    ],
    "p7_4_implementation_documents": [
      {
        "path": "code_assist_v1/knowledge_core/backup_manifest.py",
        "sha256": "sha256:a7e4695aad59d02f3fb8aae82ee3308b1c4943bc89936a82d562ad47612a856a"
      },
      {
        "path": "code_assist_v1/knowledge_core/services/backup.py",
        "sha256": "sha256:744f2f8c602518f538e5a292e7eb841aedc7a4bb28a432eb4b5373777935048f"
      },
      {
        "path": "code_assist_v1/knowledge_core/services/restore.py",
        "sha256": "sha256:3ea7b1477451959e7a58da10a951067c8c388da1992f5158b672042f4142e0cd"
      }
    ],
    "current_schema_lineage_sha256": "sha256:861a95d471d9bef0e2f386571cc4f723cc33af626c2f85812c990a96bf928604",
    "sbe_contract_audit": {
      "status": "pass",
      "input_sha256": "sha256:284d70c452fa1b742212d12286d5d3c7da9b7e9a2014d9b29163df2a805c9cf0",
      "goal_count": 20,
      "mandatory_scenario_count": 284,
      "error_count": 0
    }
  },
  "current_state": {
    "p7_4_baseline": {
      "status": "verified_existing_disabled_synthetic_baseline",
      "capabilities": [
        "online_sqlite_snapshot",
        "exact_immutable_blob_manifest",
        "blob_gc_hold",
        "atomic_verified_manifest_publication",
        "isolated_new_root_restore",
        "full_projection_rebuild"
      ],
      "retention_generations": {
        "hourly": 96,
        "daily": 30,
        "monthly": 12
      },
      "does_not_close": [
        "aggregate_G_12",
        "successor_SBE_7_1",
        "target_restore_SBE_7_2",
        "collaborative_notion_coordinated_backup",
        "production_recovery_decisions"
      ]
    },
    "sbe_successor_ownership": {
      "SBE-7.1": "not_started_owner_of_integrated_successor_backup_and_SBEOPS_010",
      "SBE-7.2": "not_started_owner_of_target_handoff_and_SBEOPS_018",
      "sbe_documents_modified_by_O0A_P1": false
    },
    "collaborative_backup_runtime_implemented": false,
    "backup_or_restore_executed_by_this_adr": false,
    "live_root_or_database_accessed": false
  },
  "authority_boundary": {
    "notion_authority": "one Notion-owned canonical database plus its referenced immutable blobs and durable collaboration log",
    "second_brain_authority": "one separately governed SBE canonical database plus its referenced immutable blobs",
    "identity_authority": "the shared Agent identity registry remains external to both content databases",
    "notion_and_sbe_database_authorities_separate": true,
    "notion_and_sbe_schema_lineages_separate": true,
    "cross_database_atomic_transaction_claimed": false,
    "coordinator_role": "record independently verified authority snapshots and one agreed publication/high-water boundary in a self-hashed generation manifest",
    "generation_publication_rule": "publish verified only after every mandatory component and every authority record verifies; otherwise retain an incomplete non-restorable generation",
    "projection_as_sole_truth_allowed": false,
    "identity_snapshot_includes_password_hashes_and_stable_subject_ids": true,
    "identity_snapshot_includes_live_sessions_tokens_or_secret_material": false
  },
  "component_inventory": {
    "mandatory_non_rebuildable": [
      {"id": "notion_canonical_database", "authority_domain": "notion", "restore_rule": "independently verify schema lineage, integrity, logical counts, and high-water markers"},
      {"id": "sbe_canonical_database", "authority_domain": "second_brain", "restore_rule": "preserve the SBE-owned backup format and independently verify schema lineage, integrity, and publication revisions"},
      {"id": "shared_identity_registry", "authority_domain": "identity", "restore_rule": "preserve stable subject IDs and password hashes but exclude every session, token, cookie, and signing secret"},
      {"id": "notion_immutable_blobs", "authority_domain": "notion", "restore_rule": "restore the exact content-addressed manifest referenced by the Notion snapshot"},
      {"id": "sbe_immutable_blobs", "authority_domain": "second_brain", "restore_rule": "restore the exact content-addressed manifest referenced by the SBE snapshot"},
      {"id": "collaboration_event_log", "authority_domain": "notion", "restore_rule": "preserve contiguous document sequence and operation-id deduplication state through the recorded high-water"},
      {"id": "collaboration_snapshots_and_checkpoints", "authority_domain": "notion", "restore_rule": "verify snapshot content hash, covered event high-water, and replay compatibility"},
      {"id": "legacy_cutover_sources", "authority_domain": "migration", "restore_rule": "retain immutable source manifests until an explicitly signed retirement packet makes them dispensable"},
      {"id": "authority_schema_and_config_markers", "authority_domain": "coordinator", "restore_rule": "bind exact schema catalogs, migration checksums, runtime source IDs, and safe configuration versions"},
      {"id": "encrypted_key_metadata", "authority_domain": "security", "restore_rule": "retain algorithm, version, and external key reference only; never copy plaintext key material"},
      {"id": "audit_outbox_and_publication_high_water", "authority_domain": "coordinator", "restore_rule": "bind per-authority audit/outbox/event/publication boundaries without claiming a cross-database transaction"}
    ],
    "rebuildable": [
      {"id": "notion_compatibility_projections", "rebuild_source": "notion canonical database and immutable blobs"},
      {"id": "sbe_markdown_index_log_graph_and_backlinks", "rebuild_source": "SBE canonical database and immutable blobs"},
      {"id": "fts_vector_and_search_caches", "rebuild_source": "authorized canonical content using the restored schema/config marker"},
      {"id": "derived_inbox_and_notification_views", "rebuild_source": "canonical audit/outbox/event state"},
      {"id": "generated_previews_and_thumbnails", "rebuild_source": "verified immutable blobs and canonical metadata"},
      {"id": "materialized_collaboration_client_views", "rebuild_source": "verified collaboration snapshot plus contiguous event replay"}
    ],
    "never_restore": [
      {"id": "sessions_csrf_tokens_tickets_and_bearer_tokens", "reason": "restored credentials could silently revive pre-incident authority"},